1,Blanditiis ullam repudiandae.,Nihil magni odit voluptas voluptates dolore cumque nobis. Rerum praesentium iste repellat non libero.,Zaawansowane
2,Blanditiis error nemo.,Voluptatem est quasi. Ad assumenda delectus doloremque ut ipsa. Iusto iusto quibusdam quo.,Inne
3,Sed labore ullam.,Recusandae quo perspiciatis ex. Illo sit eligendi incidunt. At quo necessitatibus temporibus voluptatum quidem.,Zaawansowane
4,Sed ratione reiciendis illum.,"Veniam illo ab alias. Rem inventore aliquid quod.
Vel eaque mollitia aliquid ipsam hic a quibusdam. Ab quasi blanditiis quasi voluptates beatae.",Ogólne
5,Eum doloremque qui qui.,"Eos eaque quae vero doloribus dolor deserunt. Recusandae nisi corporis blanditiis.
Sint assumenda quas vel provident.",Ogólne
6,Natus voluptatem nisi.,Odio delectus libero iure magni rem. Aliquid non esse rem accusantium nihil quibusdam a. Quisquam rerum nam quas officiis praesentium itaque.,Podstawy
7,Quasi autem cumque.,"Quam debitis vitae.
Voluptatum soluta temporibus molestiae voluptas.",Inne
8,Magni velit quo doloribus dolorum.,Mollitia ab eaque ea. Modi illum velit aperiam libero ratione alias. Quisquam sint sint ratione.,Ogólne
9,Vitae magnam laboriosam.,Perspiciatis deleniti ratione sed dolorum. Voluptatibus repellendus minus deleniti.,Zaawansowane
10,In fugit ullam impedit tenetur.,Omnis neque culpa deleniti temporibus ipsam tempore numquam. Ipsa voluptatem adipisci in maxime aspernatur voluptatibus qui.,Zaawansowane
11,Non accusamus ipsa.,Quo doloremque perspiciatis nisi tempora beatae. Unde laudantium debitis error.,Podstawy
12,Aliquam non natus minima deleniti.,Tenetur sit reiciendis facere dolore. Dignissimos occaecati optio aut rem. Placeat cumque eveniet atque assumenda quasi impedit quod.,Specjalistyczne
13,Ducimus cumque error reiciendis.,Aliquam esse culpa amet excepturi. Incidunt cum repellendus autem assumenda quos. Officia quos quod aut.,Zaawansowane
14,Corporis officiis sed sit.,Sequi similique explicabo praesentium ipsum et ex in. Autem ratione fugit ullam iusto pariatur quidem. Eligendi dolorem cum rem at magni.,Inne
15,Vel rem corporis sapiente.,Numquam temporibus vitae eum. Praesentium voluptatem modi repellat. Nemo ullam porro ex.,Specjalistyczne
16,Possimus autem eveniet dolor.,Eaque quod ipsum laudantium placeat incidunt dignissimos. Cumque voluptatem illo libero veritatis quis.,Specjalistyczne
17,Eveniet dolor fuga dolore.,Voluptates provident voluptas eligendi cum ad.,Inne
18,Autem optio modi aut.,Consectetur illo laboriosam expedita tempore dolore. Deserunt illo esse consequuntur accusamus velit. Veniam ipsa libero ut rem.,Ogólne
19,Sequi sit neque corporis quae.,Eum voluptates eius fuga. Deleniti fuga nam eligendi aut voluptatem repellat.,Ogólne
20,Maiores exercitationem illo autem.,Vero saepe dignissimos optio non. Pariatur in natus quis iste voluptates dolor.,Ogólne
21,Aspernatur velit amet doloremque.,Repudiandae beatae autem velit. Repellendus dolorem deserunt veritatis ullam esse placeat. Totam alias nostrum temporibus.,Specjalistyczne
22,Magnam facilis nihil explicabo.,"Ducimus in natus quisquam culpa. Qui minus accusantium explicabo commodi.
Cupiditate perferendis eos sit. Laborum iste optio magni nemo vero.",Podstawy
23,Quidem nulla veniam.,Dolores molestias nam asperiores quaerat delectus et. Qui omnis nobis ex.,Podstawy
24,Necessitatibus amet molestiae.,"Neque aliquam sed eveniet facere. Quae nemo architecto ex quasi hic.
Amet atque esse.",Zaawansowane
25,Ullam iste molestiae eveniet quod.,Vero saepe cum labore minus. Nam eum eos id. Hic quibusdam repellendus magnam dolores alias error.,Specjalistyczne
26,Ratione sequi modi consectetur.,Sapiente expedita consectetur modi placeat. Odio porro illo eum tempora ad eligendi voluptates. Unde pariatur voluptas itaque quis.,Podstawy
27,Explicabo neque ab.,Iste modi temporibus itaque. Reprehenderit ipsam aliquid culpa voluptates quis ratione.,Zaawansowane
28,Accusamus vitae harum.,Laudantium nesciunt ut ratione.,Ogólne
29,Quidem accusantium est dolorem.,Impedit ex dignissimos animi ratione. Ratione cum consequuntur distinctio ducimus nemo.,Specjalistyczne
30,Ea enim commodi eius unde magni.,Enim illo asperiores amet nulla voluptates ipsam. Eos id et earum error culpa.,Podstawy
